<?xml version="1.0" encoding="UTF-8"?>
<xs:schema xmlns:xs="http://www.w3.org/2001/XMLSchema" elementFormDefault="qualified" attributeFormDefault="unqualified">
	<xs:element name="crossreferences">
		<xs:annotation>
			<xs:documentation>Scripture verse crossreferences</xs:documentation>
		</xs:annotation>
		<xs:complexType>
			<xs:choice minOccurs="0" maxOccurs="unbounded">
				<xs:element name="comment" type="xs:string" minOccurs="0" maxOccurs="unbounded"/>
				<xs:element name="xlat" minOccurs="0" maxOccurs="unbounded">
					<xs:complexType>
						<xs:sequence>
							<xs:element name="source" type="xs:string"/>
							<xs:element name="target" type="xs:string"/>
						</xs:sequence>
					</xs:complexType>
				</xs:element>
				<xs:element name="xref" minOccurs="0" maxOccurs="unbounded">
					<xs:complexType>
						<xs:sequence>
							<xs:element name="at" type="xs:string"/>
							<xs:element name="note" type="xs:string"/>
						</xs:sequence>
					</xs:complexType>
				</xs:element>
			</xs:choice>
		</xs:complexType>
	</xs:element>
</xs:schema>
